Enter password: ********
Welcome to the MySQL monitor.  Commands end with ; or \g.
Your MySQL connection id is 38
Server version: 8.0.36 MySQL Community Server - GPL

Copyright (c) 2000, 2024, Oracle and/or its affiliates.

Oracle is a registered trademark of Oracle Corporation and/or its
affiliates. Other names may be trademarks of their respective
owners.

Type 'help;' or '\h' for help. Type '\c' to clear the current input statement.

mysql> show databases;
+--------------------+
| Database           |
+--------------------+
| b99_8pm            |
| customers          |
| information_schema |
| mysql              |
| performance_schema |
| sakila             |
| sys                |
| world              |
+--------------------+
8 rows in set (0.01 sec)

mysql> use b99_8pm;
Database changed
mysql> select * from emp;
+-------+--------+-----------+------+------------+------+------+--------+
| empno | ename  | job       | mgr  | hiredate   | sal  | comm | deptno |
+-------+--------+-----------+------+------------+------+------+--------+
|  7369 | SMITH  | CLERK     | 7902 | 1980-12-17 |  800 | NULL |     20 |
|  7499 | ALLEN  | SALESMAN  | 7698 | 1981-02-20 | 1600 |  300 |     30 |
|  7521 | WARD   | SALESMAN  | 7698 | 1981-02-22 | 1250 |  500 |     30 |
|  7566 | JONES  | MANAGER   | 7839 | 1981-04-02 | 2975 | NULL |     20 |
|  7654 | MARTIN | SALESMAN  | 7698 | 1981-09-22 | 1250 | 1400 |     30 |
|  7698 | BLAKE  | MANAGER   | 7839 | 1981-05-01 | 2850 | NULL |     30 |
|  7782 | CLARK  | MANAGER   | 7839 | 1981-06-09 | 2450 | NULL |     10 |
|  7788 | SCOTT  | ANALYST   | 7566 | 1987-09-23 | 3000 | NULL |     20 |
|  7839 | KING   | PRESIDENT | NULL | 1981-11-19 | 5000 | NULL |     10 |
|  7844 | TURNER | SALESMAN  | 7698 | 1981-09-08 | 1500 |    0 |     30 |
|  7876 | ADAMS  | CLERK     | 7788 | 1987-08-24 | 1100 | NULL |     20 |
|  7900 | JAMES  | CLERK     | 7698 | 1981-12-03 |  950 | NULL |     30 |
|  7902 | FORD   | ANALYST   | 7566 | 1981-12-03 | 3000 | NULL |     20 |
|  7934 | MILLER | CLERK     | 7782 | 1982-01-23 | 1300 | NULL |     10 |
+-------+--------+-----------+------+------------+------+------+--------+
14 rows in set (0.00 sec)

mysql> select * from dept;
+--------+------------+----------+
| deptno | dname      | loc      |
+--------+------------+----------+
|     10 | ACCOUNTING | NEW YORK |
|     20 | RESEARCH   | DALLAS   |
|     30 | SALES      | CHICAGO  |
|     40 | OPERATIONS | BOSTON   |
+--------+------------+----------+
4 rows in set (0.00 sec)

mysql> select * from emp where length(ename)=6 and right(ename,1)='H';
Empty set (0.00 sec)

mysql> select * from emp where ename= "SMITH" or ename="FORD";
+-------+-------+---------+------+------------+------+------+--------+
| empno | ename | job     | mgr  | hiredate   | sal  | comm | deptno |
+-------+-------+---------+------+------------+------+------+--------+
|  7369 | SMITH | CLERK   | 7902 | 1980-12-17 |  800 | NULL |     20 |
|  7902 | FORD  | ANALYST | 7566 | 1981-12-03 | 3000 | NULL |     20 |
+-------+-------+---------+------+------------+------+------+--------+
2 rows in set (0.00 sec)

Q-1. Write an SQL query to print details of workers excluding first names, “Vipul” and “Satish” from Worker table.

mysql> select * from emp where ename!= "SMITH" or ename!="FORD";
+-------+--------+-----------+------+------------+------+------+--------+
| empno | ename  | job       | mgr  | hiredate   | sal  | comm | deptno |
+-------+--------+-----------+------+------------+------+------+--------+
|  7369 | SMITH  | CLERK     | 7902 | 1980-12-17 |  800 | NULL |     20 |
|  7499 | ALLEN  | SALESMAN  | 7698 | 1981-02-20 | 1600 |  300 |     30 |
|  7521 | WARD   | SALESMAN  | 7698 | 1981-02-22 | 1250 |  500 |     30 |
|  7566 | JONES  | MANAGER   | 7839 | 1981-04-02 | 2975 | NULL |     20 |
|  7654 | MARTIN | SALESMAN  | 7698 | 1981-09-22 | 1250 | 1400 |     30 |
|  7698 | BLAKE  | MANAGER   | 7839 | 1981-05-01 | 2850 | NULL |     30 |
|  7782 | CLARK  | MANAGER   | 7839 | 1981-06-09 | 2450 | NULL |     10 |
|  7788 | SCOTT  | ANALYST   | 7566 | 1987-09-23 | 3000 | NULL |     20 |
|  7839 | KING   | PRESIDENT | NULL | 1981-11-19 | 5000 | NULL |     10 |
|  7844 | TURNER | SALESMAN  | 7698 | 1981-09-08 | 1500 |    0 |     30 |
|  7876 | ADAMS  | CLERK     | 7788 | 1987-08-24 | 1100 | NULL |     20 |
|  7900 | JAMES  | CLERK     | 7698 | 1981-12-03 |  950 | NULL |     30 |
|  7902 | FORD   | ANALYST   | 7566 | 1981-12-03 | 3000 | NULL |     20 |
|  7934 | MILLER | CLERK     | 7782 | 1982-01-23 | 1300 | NULL |     10 |
+-------+--------+-----------+------+------------+------+------+--------+
14 rows in set (0.00 sec)

mysql> select * from emp where ename!='smith' and 'ford';
Empty set, 1 warning (0.00 sec)

mysql> select * from emp where ename!= "SMITH" and ename!="FORD";
+-------+--------+-----------+------+------------+------+------+--------+
| empno | ename  | job       | mgr  | hiredate   | sal  | comm | deptno |
+-------+--------+-----------+------+------------+------+------+--------+
|  7499 | ALLEN  | SALESMAN  | 7698 | 1981-02-20 | 1600 |  300 |     30 |
|  7521 | WARD   | SALESMAN  | 7698 | 1981-02-22 | 1250 |  500 |     30 |
|  7566 | JONES  | MANAGER   | 7839 | 1981-04-02 | 2975 | NULL |     20 |
|  7654 | MARTIN | SALESMAN  | 7698 | 1981-09-22 | 1250 | 1400 |     30 |
|  7698 | BLAKE  | MANAGER   | 7839 | 1981-05-01 | 2850 | NULL |     30 |
|  7782 | CLARK  | MANAGER   | 7839 | 1981-06-09 | 2450 | NULL |     10 |
|  7788 | SCOTT  | ANALYST   | 7566 | 1987-09-23 | 3000 | NULL |     20 |
|  7839 | KING   | PRESIDENT | NULL | 1981-11-19 | 5000 | NULL |     10 |
|  7844 | TURNER | SALESMAN  | 7698 | 1981-09-08 | 1500 |    0 |     30 |
|  7876 | ADAMS  | CLERK     | 7788 | 1987-08-24 | 1100 | NULL |     20 |
|  7900 | JAMES  | CLERK     | 7698 | 1981-12-03 |  950 | NULL |     30 |
|  7934 | MILLER | CLERK     | 7782 | 1982-01-23 | 1300 | NULL |     10 |
+-------+--------+-----------+------+------------+------+------+--------+
12 rows in set (0.00 sec)

Q-2. Write an SQL query to print details of the Workers whose FIRST_NAME ends with ‘h’ and contains six alphabets.


mysql> select ename from emp where ename like '%h';
+-------+
| ename |
+-------+
| SMITH |
+-------+
1 row in set (0.00 sec)

mysql> select ename from emp where ename like '%n';
+--------+
| ename  |
+--------+
| ALLEN  |
| MARTIN |
+--------+
2 rows in set (0.00 sec)

mysql> select ename,length(ename) from emp where ename like "%h" and length(ename)=6;
Empty set (0.00 sec)

mysql> select ename,length(ename) from emp where ename like "%n" and length(ename)=6;
+--------+---------------+
| ename  | length(ename) |
+--------+---------------+
| MARTIN |             6 |
+--------+---------------+
1 row in set (0.00 sec)

mysql> elect * from emp where Email like '%@%.%';
ERROR 1064 (42000): You have an error in your SQL syntax; check the manual that corresponds to your MySQL server version for the right syntax to use near 'elect * from emp where Email like '%@%.%'' at line 1
mysql> create table emp_copy as select 8 from emp;
ERROR 1050 (42S01): Table 'emp_copy' already exists
mysql> create table emp_copy as select * from emp;
ERROR 1050 (42S01): Table 'emp_copy' already exists
mysql> select * from emp_copy
    -> ;
+-------+--------+-----------+------+------------+------+------+--------+
| empno | ename  | job       | mgr  | hiredate   | sal  | comm | deptno |
+-------+--------+-----------+------+------------+------+------+--------+
|  7369 | SMITH  | CLERK     | 7902 | 1980-12-17 |  800 | NULL |     20 |
|  7499 | ALLEN  | SALESMAN  | 7698 | 1981-02-20 | 1600 |  300 |     30 |
|  7521 | WARD   | SALESMAN  | 7698 | 1981-02-22 | 1250 |  500 |     30 |
|  7566 | JONES  | MANAGER   | 7839 | 1981-04-02 | 2975 | NULL |     20 |
|  7654 | MARTIN | SALESMAN  | 7698 | 1981-09-22 | 1250 | 1400 |     30 |
|  7698 | BLAKE  | MANAGER   | 7839 | 1981-05-01 | 2850 | NULL |     30 |
|  7782 | CLARK  | MANAGER   | 7839 | 1981-06-09 | 2450 | NULL |     10 |
|  7788 | SCOTT  | ANALYST   | 7566 | 1987-09-23 | 3000 | NULL |     20 |
|  7839 | KING   | PRESIDENT | NULL | 1981-11-19 | 5000 | NULL |     10 |
|  7844 | TURNER | SALESMAN  | 7698 | 1981-09-08 | 1500 |    0 |     30 |
|  7876 | ADAMS  | CLERK     | 7788 | 1987-08-24 | 1100 | NULL |     20 |
|  7900 | JAMES  | CLERK     | 7698 | 1981-12-03 |  950 | NULL |     30 |
|  7902 | FORD   | ANALYST   | 7566 | 1981-12-03 | 3000 | NULL |     20 |
|  7934 | MILLER | CLERK     | 7782 | 1982-01-23 | 1300 | NULL |     10 |
+-------+--------+-----------+------+------------+------+------+--------+
14 rows in set (0.00 sec)

Q-3. Write a query to validate Email of Employee.

mysql> alter table emp_copy add Email varchar(25);
Query OK, 0 rows affected (0.06 sec)
Records: 0  Duplicates: 0  Warnings: 0

mysql> desc emp_copy;
+----------+-------------+------+-----+---------+-------+
| Field    | Type        | Null | Key | Default | Extra |
+----------+-------------+------+-----+---------+-------+
| empno    | int         | NO   |     | NULL    |       |
| ename    | varchar(10) | YES  |     | NULL    |       |
| job      | varchar(9)  | YES  |     | NULL    |       |
| mgr      | int         | YES  |     | NULL    |       |
| hiredate | date        | YES  |     | NULL    |       |
| sal      | int         | YES  |     | NULL    |       |
| comm     | int         | YES  |     | NULL    |       |
| deptno   | int         | YES  |     | NULL    |       |
| Email    | varchar(25) | YES  |     | NULL    |       |
+----------+-------------+------+-----+---------+-------+
9 rows in set (0.01 sec)

mysql> insert into emp_copy (Email) Values ('smith@gmail.com');
ERROR 1364 (HY000): Field 'empno' doesn't have a default value
mysql> insert into emp_copy (Email) Values ('smith@gmail.com') where empno=7369;
ERROR 1064 (42000): You have an error in your SQL syntax; check the manual that corresponds to your MySQL server version for the right syntax to use near 'where empno=7369' at line 1
mysql> insert into emp_copy (Email) Values ('smith@gmail.com');
ERROR 1364 (HY000): Field 'empno' doesn't have a default value
mysql> insert into emp_copy (Email) Values ('smith@gmail.com');
ERROR 1364 (HY000): Field 'empno' doesn't have a default value
mysql>
mysql> select * from emp_copy;
+-------+--------+-----------+------+------------+------+------+--------+-------+
| empno | ename  | job       | mgr  | hiredate   | sal  | comm | deptno | Email |
+-------+--------+-----------+------+------------+------+------+--------+-------+
|  7369 | SMITH  | CLERK     | 7902 | 1980-12-17 |  800 | NULL |     20 | NULL  |
|  7499 | ALLEN  | SALESMAN  | 7698 | 1981-02-20 | 1600 |  300 |     30 | NULL  |
|  7521 | WARD   | SALESMAN  | 7698 | 1981-02-22 | 1250 |  500 |     30 | NULL  |
|  7566 | JONES  | MANAGER   | 7839 | 1981-04-02 | 2975 | NULL |     20 | NULL  |
|  7654 | MARTIN | SALESMAN  | 7698 | 1981-09-22 | 1250 | 1400 |     30 | NULL  |
|  7698 | BLAKE  | MANAGER   | 7839 | 1981-05-01 | 2850 | NULL |     30 | NULL  |
|  7782 | CLARK  | MANAGER   | 7839 | 1981-06-09 | 2450 | NULL |     10 | NULL  |
|  7788 | SCOTT  | ANALYST   | 7566 | 1987-09-23 | 3000 | NULL |     20 | NULL  |
|  7839 | KING   | PRESIDENT | NULL | 1981-11-19 | 5000 | NULL |     10 | NULL  |
|  7844 | TURNER | SALESMAN  | 7698 | 1981-09-08 | 1500 |    0 |     30 | NULL  |
|  7876 | ADAMS  | CLERK     | 7788 | 1987-08-24 | 1100 | NULL |     20 | NULL  |
|  7900 | JAMES  | CLERK     | 7698 | 1981-12-03 |  950 | NULL |     30 | NULL  |
|  7902 | FORD   | ANALYST   | 7566 | 1981-12-03 | 3000 | NULL |     20 | NULL  |
|  7934 | MILLER | CLERK     | 7782 | 1982-01-23 | 1300 | NULL |     10 | NULL  |
+-------+--------+-----------+------+------------+------+------+--------+-------+
14 rows in set (0.00 sec)

mysql> insert into emp_copy(Email) values('smith@example.com') where ename.emp_copy-''smith;
ERROR 1064 (42000): You have an error in your SQL syntax; check the manual that corresponds to your MySQL server version for the right syntax to use near 'where ename.emp_copy-''smith' at line 1
mysql> update emp_copy set Email = 'smithhh@gmail.com' where empno=7369;
Query OK, 1 row affected (0.01 sec)
Rows matched: 1  Changed: 1  Warnings: 0

mysql> select * from emp_copy;
+-------+--------+-----------+------+------------+------+------+--------+-------------------+
| empno | ename  | job       | mgr  | hiredate   | sal  | comm | deptno | Email             |
+-------+--------+-----------+------+------------+------+------+--------+-------------------+
|  7369 | SMITH  | CLERK     | 7902 | 1980-12-17 |  800 | NULL |     20 | smithhh@gmail.com |
|  7499 | ALLEN  | SALESMAN  | 7698 | 1981-02-20 | 1600 |  300 |     30 | NULL              |
|  7521 | WARD   | SALESMAN  | 7698 | 1981-02-22 | 1250 |  500 |     30 | NULL              |
|  7566 | JONES  | MANAGER   | 7839 | 1981-04-02 | 2975 | NULL |     20 | NULL              |
|  7654 | MARTIN | SALESMAN  | 7698 | 1981-09-22 | 1250 | 1400 |     30 | NULL              |
|  7698 | BLAKE  | MANAGER   | 7839 | 1981-05-01 | 2850 | NULL |     30 | NULL              |
|  7782 | CLARK  | MANAGER   | 7839 | 1981-06-09 | 2450 | NULL |     10 | NULL              |
|  7788 | SCOTT  | ANALYST   | 7566 | 1987-09-23 | 3000 | NULL |     20 | NULL              |
|  7839 | KING   | PRESIDENT | NULL | 1981-11-19 | 5000 | NULL |     10 | NULL              |
|  7844 | TURNER | SALESMAN  | 7698 | 1981-09-08 | 1500 |    0 |     30 | NULL              |
|  7876 | ADAMS  | CLERK     | 7788 | 1987-08-24 | 1100 | NULL |     20 | NULL              |
|  7900 | JAMES  | CLERK     | 7698 | 1981-12-03 |  950 | NULL |     30 | NULL              |
|  7902 | FORD   | ANALYST   | 7566 | 1981-12-03 | 3000 | NULL |     20 | NULL              |
|  7934 | MILLER | CLERK     | 7782 | 1982-01-23 | 1300 | NULL |     10 | NULL              |
+-------+--------+-----------+------+------------+------+------+--------+-------------------+
14 rows in set (0.00 sec)

mysql> update emp_copy set Email = 'allen@gmail.com' where ename='ALLEN';
Query OK, 1 row affected (0.01 sec)
Rows matched: 1  Changed: 1  Warnings: 0

mysql> select * from emp_copy;
+-------+--------+-----------+------+------------+------+------+--------+-------------------+
| empno | ename  | job       | mgr  | hiredate   | sal  | comm | deptno | Email             |
+-------+--------+-----------+------+------------+------+------+--------+-------------------+
|  7369 | SMITH  | CLERK     | 7902 | 1980-12-17 |  800 | NULL |     20 | smithhh@gmail.com |
|  7499 | ALLEN  | SALESMAN  | 7698 | 1981-02-20 | 1600 |  300 |     30 | allen@gmail.com   |
|  7521 | WARD   | SALESMAN  | 7698 | 1981-02-22 | 1250 |  500 |     30 | NULL              |
|  7566 | JONES  | MANAGER   | 7839 | 1981-04-02 | 2975 | NULL |     20 | NULL              |
|  7654 | MARTIN | SALESMAN  | 7698 | 1981-09-22 | 1250 | 1400 |     30 | NULL              |
|  7698 | BLAKE  | MANAGER   | 7839 | 1981-05-01 | 2850 | NULL |     30 | NULL              |
|  7782 | CLARK  | MANAGER   | 7839 | 1981-06-09 | 2450 | NULL |     10 | NULL              |
|  7788 | SCOTT  | ANALYST   | 7566 | 1987-09-23 | 3000 | NULL |     20 | NULL              |
|  7839 | KING   | PRESIDENT | NULL | 1981-11-19 | 5000 | NULL |     10 | NULL              |
|  7844 | TURNER | SALESMAN  | 7698 | 1981-09-08 | 1500 |    0 |     30 | NULL              |
|  7876 | ADAMS  | CLERK     | 7788 | 1987-08-24 | 1100 | NULL |     20 | NULL              |
|  7900 | JAMES  | CLERK     | 7698 | 1981-12-03 |  950 | NULL |     30 | NULL              |
|  7902 | FORD   | ANALYST   | 7566 | 1981-12-03 | 3000 | NULL |     20 | NULL              |
|  7934 | MILLER | CLERK     | 7782 | 1982-01-23 | 1300 | NULL |     10 | NULL              |
+-------+--------+-----------+------+------------+------+------+--------+-------------------+
14 rows in set (0.00 sec)

mysql>